question_id,question,status,priority,notes
Q0001,Why and when was the surname 'Amiri' adopted by this branch?,open,high,
Q0002,What precisely did the title Amir Arfa' signify in this family and period?,open,high,
Q0003,How did the Kabudarahang estates enter the family?,open,high,
Q0004,What is the exact documentary relationship between Mohammad Hossein Khan and Haji Mohammad Khan Jeyhunabadi?,open,high,The user-supplied chain needs confirmation from S0001 and later sources.
Q0005,"Which members of this branch served in government, the military, or the Majles?",open,high,
Q0006,"When did Mohtaj Ali Khan acquire the title Amir Arfa', and what office or rank did it represent?",open,high,S0001 names the title but does not explain its grant or function in the indexed passages.
Q0007,"Is the Yavar/Sarhang Abdollah Khan who served at Herat identical with Abdollah Khan Sa’ed al-Saltaneh, Sardar Akram, and Haji Amir Nezam (P0004)?",open,high,Do not merge P0015 with P0004 until chronology and lineage are independently confirmed.
